Stars,Reviews
5.0 out of 5 stars,"and now we are on year two—the bag is still fully functional. for the past two years this bag has been indoors a total of four nights, nights where the threat of heavy freezing rain would hinder the morning commute. the rest of the time it is in the new england elements. i’ll add a photo. it is faded to a very light gray, but zipper still fine and it carries my stuff just fine.after one year, i’m writing a new review. i have an interesting bicycle life: i commute by bicycle. i ride twelve miles to work five days a week, regardless of temperature or conditions. so give or take a few dozen miles, i bike about 3,000 miles per year.i also abuse my bike. i leave it outside in snow, sleet, rain, hail, and the summer sun. it is a 1995 trek iron horse. it is a beast. so any equipment i purchase is in for a test.i’m uploading a photo of this bag one year later. it is a little faded, but it is as functional as the day i strapped it on. i truly thought i would get a few months out of it at maximum. judging from its condition after 3,000 miles, i think i’ll get many more years out of it.it is spacious enough to hold my iphone, a boo kit, a repair kit, my keys, and a sandwich. it is a remarkable piece of equipment. i have bought two more, one for my other bike and one as a gift."
5.0 out of 5 stars,"this is one of those products that actually looks better when you get it! i was a little hesitant in purchasing this as i thought it would not allow room for my water bottle and hand air pump-- no problem, take a look at attached images. the bonus is it holds my leatherman wave knife w/ belt case, note 8 w/ extra large case, tire patch kit, wallet and pro bike tool mini ratchet tool set with a tiny bit of room left over. it also stays secure and out of the way while pedaling.it is an amazing bike storage bag and extremely user friendly taking a full 2 minutes to install! as you can see by the picture i purchased another one. we ride in the northwest mountains of maine and enjoy carrying all the essentials without a back pack or saddle bags.highly recommend this product!recommendation: recommend applying lip balm (bees wax) to the zipper to keep zipper opening easily and to prevent undue stress on the stitching.happy trails! :)"
5.0 out of 5 stars,"i love this frame bike bag! well made, big enough but not bulky, straps on securely! i use it to carry a tire repair kit with pump, my key fob and wallet. doesn't get in the way while riding! looks great!!! very functional and keeps it's shape! if you're looking for a nice carry bag for your bike, this is it!!!"
5.0 out of 5 stars,"this is a very nice bag for the money. very functional. i use mine to store my tools, mini pump, spare tube etc. be aware that if your top tube slants down, it will be a tight fit with your water bottle (see picture). my bike is a trek fx2 hybrid with an angled top tube so this bag pushes up against the water bottle and looks a little weird. but it fits and works fine."
5.0 out of 5 stars,"i put topeak bike rack on my other bikes and also have a topeak saddle bag. i didn't want to put a rack on this mountain bike as i want to keep it light. i didn't want to use a saddle bag because i need to adjust the seat height during my rides and the saddle bag would be a problem. i also have a backpack and a waist pack but the backpack isn't that comfortable and the waist pack is simply too small for storage. when i saw the aduro storage bag, i thought it was perfect. it is actually a pretty large storage bag and can hold a lot of stuff. i need to carry a spare tube, co2 tire inflator or topeak peakini mini pump, phone, keys, nutrition bar, etc.. with this bag, i can comfortably carry all my essential items (not including my bike lock)..... con? none so far. it makes contact with my thermos water bottle but not an issue."
5.0 out of 5 stars,"works extremely well. it would be perfect except it doesn't hang absolutely centered under the cross bar due to positioning of velcro straps. however, that's not a performance issue. it's large and easily holds an iphone6+, xtra tubes and repair stuff. i'm 6'2"" and have a large bike frame, and the size still interferes with a water bottle on the seat tube, so i just bought a larger bottle for the down tube bottle cage."
1.0 out of 5 stars,the straps are so long the fuzzy part ends up overlapping itself and the velcro cannot secure itself down. the stitch job connecting the velcro is pathetic. made with zero quality assurance. it was also punctured 6 different times to secure the cardboard packaging with the branding on it. who does that? just outright damages the product just to hold cardboard in place. it was already bagged. redundant. these products are shamelessly mass produced with not a care in the world if all of it ends up in a landfill. how hard is it to actually look at the product and test it along the way!?
1.0 out of 5 stars,"this seemed like a winner. i found a nice way to hang it off the top bar, velcro held well, bag zipped well. i loaded it with a small battery op pump, a wrench and a multitool. maybe 3 pounds of stuff, and i left it for the night. planning a 40 mile run in the morning, so i wanted some emergency supplies.when i wheeled it out the next morning, one of the three straps had ripped loose completely from the stitching. was just hanging there. keep in mind this was before i'd driven the bike at all, before i'd taken it over any bumps or anything.useless."
5.0 out of 5 stars,this bag is just what i was looking for. it is roomy enough for emergency tools and a patch kit as well as a compact tire pump plus my cell phone! i like the blue color as it matches my new bike too. being a larger bag it fits snugly between the upright and cross member and brushes against the water bottle holder. i was worried it might interfere with peddling however it does not. the only improvement i could suggest is making the velcro straps about a quarter inch or third of an inch longer to accommodate thicker cross members.
5.0 out of 5 stars,"i like this aduro sport bicycle bike storage bag.my carbon road bike has a slightly awkward shape triangle, and nothing exactly fits inside, along with my water bottles.while this pack didn't quite fit either, i find a quite useful alternate mounting position that i very much like.i have it inverted on my top tube, just under the forward side of my saddle. unconventional location, but it fits perfectly, makes for an aero flow in front to my post, doesn't impede my pedaling, looks good too.the bag is well made, holds a tube, co2 inflator and 2 cartridges, allen wrenches, protein bar, and has some room left.the zipper is very smooth; but in my unusual configuration, it hangs down so i use a small bit of teflon coated copper wire to hold it up. probably no one else using this pack would need this workaround.i haven't ridden in the rain, so can't speak to that.i've had it in use for about a month and am very pleased."
1.0 out of 5 stars,"updated review:so i've had this item for just over a year now and it's falling apart! i've had to re-sew all the velcro straps but the underlying fabric is just coming apart.so..i added denim patches on the inside where the straps attach and sewed them to reinforce those areas... held for a little bit but the fabric is such crap (strands instead of mesh) that it's just falling apart around the patch!now.. the heaviest thing i'm carrying is small frame lock... along with my phone, a few allen wrenches, patch kit, etc.i doubt the entire bag & contents weighs even 5 lbs.waste of money!especially considering that my previous bike bag lasted more than 25 yrs! again it's only been one year.. maybe 150 days of riding!original review:i like the size, ease of installation and placement. time will tell how sturdy it is. my biggest qualm with the bag is that the yellow color is not what is represented. my monitor is excellently color calibrated and the yellow on the bag is more of a dull w/ slight green undertones as opposed to the vibrant golden/sun yellow in the picture."
4.0 out of 5 stars,"i bought the bag to be able to stash my wallet and keys in while riding but wanted something slim i wouldn't notice on the bike. this bag fit perfect on my trek marlin 5. build seems okay, my only worry is the longevity of the velcro in dusty/dirty conditions but time will tell."
5.0 out of 5 stars,"as opposed to what others have mentioned, the straps actually do hold very tightly and i mountain bike very hard and rough on my bike. the people that said they were loose didn't know how to put the straps on properly. although to be fair, i'm not an engineer and had to call my engineer friend from work to show me how to strap them on properly (i felt extremely dumb even though i'm normally good mechanically). my pride and dignity aside, they don't strap on like any other strap i've ever put on, but they work perfectly!100% satisfied! just make sure if you have a waterbottle holder, that the dimensions of this won't collide. my bike's geometry does cause it to collide a bit, but practically speaking is not an issue. i couldn't find anything else on the market that was big enough like this one and actually worked well. would recommend"
5.0 out of 5 stars,bought for my wife for her charge fat tire bike to carry small items - mainly cell phone. the behind the seat bag on her road and cross bikes wouldn't work because of rear fender and lower seat height. this is much handier for her anyway. i'll probably get one for my fat tire bike too.
5.0 out of 5 stars,"this unit might not be for you because it is fairly large but so far i have found it to be very good. i keep a hex head tool, canister inflater, tire removal levers, and patches in it as well as car keys. it has a net inside to allow one to minimally organize items. zipper is on the edge of the top for easy access when mounted. good quality material. and the velcro straps work well on my aluminum tubes. an added plus is the gap between the top tube and seat tube that accommodates the prong on my allen hitch-mounted bicycle carrier. my top tube is horizontal so you may not have such a gap on a sloped top tube. so far i like it the best of the carrier gizmos i've tried. if you carry a water bottle on the seat tube it will probably get in the way. i carry mine of the down tube."
3.0 out of 5 stars,"this item is sturdy and will likely last. however.1. one really can't open it when it is mounted.2. with my bike rack, the item must be removed to mount the bike (that's on me for not recognizing before purchase).3. the mounting bracket the attaches to the seat post immediately took paint off. i don't care given that my bike is roughly handled, but many would care about this.if i buy something similar again, it will be one of those little bags that hangs under the seat."
2.0 out of 5 stars,"i’ve never seen such a poorly designed item that received 5 stars.here are the problems with it:1) the velcro straps are not suitable for small to medium diameter frame bars. if you try to install on a small diameter bar, the strap will wrap around so far that it won’t match up the velcro to the catchy part. this means you have to loosen the strap but then the bag moves around and isn’t secure.2) the velcro straps are reversed. they should have the ends wind up on the opposite side of where the zipper opens up. as it is, the strap ends dangle in front of the zipper and are a nuisance when trying to reach your hand in there.3) be warned that the “red” color is more of a burnt orange, not a true red.4) there was some messy stitching on this bag which is easily visible and i wouldn’t count on it lasting."
3.0 out of 5 stars,"disclaimer: i did have something heavy in the bag. however, it only lasted a week riding around a college campus with this heavy thing secured inside and all the velcro loops securely attached as they are designed to do. one of the plastic buckle-ish-things that hold the velcro straps together (i.e., the piece that makes the strap a strap) broke during a pretty normal ride. i hit plenty of bumps, but the bag has enough space to hold much more weight and therefore be studied in my opinion.speaking of space, it is quite roomy and attached quite well. it did not move around much, and i think with less than 3 or 4 lbs of stuff inside, it might hold up very well. i did not test its waterproofness. i liked the concept and design of the bag. i have made/modified many storage pouches for backpacks, tactical vests, web belts, etc., so i will testify that the materials of this bag are its killer. if you want something that will last and hold up to anything forceful or stressful on its components... this is probably not your bag. it is not durable nylon or plastic and the stitches are not very neat either."
2.0 out of 5 stars,"with much anticipation, waited for the color i wanted to get of this bag. upon mounting, realized it's quite large and roomy, which is great and all, but if you have any sort of water bottle holder? fuhgetaboutit! just won't fit right, and if you wedge it between the bottle holder, it will push it's way to the left of the frame, off center. to make matters worse, i was trying to adjust the fit, when one of the very thin plastic clips that the velcro loops through broke, making it sag even more, and making it worthless to me now. 2 stars because it's a nice bag with a lot of room, but cheap components to mount with. what a disappointment!"
4.0 out of 5 stars,"the first thing i found out, after installing before a 45 mile ride (reason i needed a bigger bag) was that when mounted inside the frame, under the seat post, the vertical bottle holder on the seat post frame was not useable. so while i have 2 bottle holders, only the forward more angular one was useable. the bag is long and make even a short bottle a not worth it option. however, the bag does its job and holds a lot of stuff, and compliments an under seat (off the back) bag perfectly. used it to hold a couple energy bars, some gel chews, my phone... and when halfway i took my sleeves off and put them in the bag too. it was secure and didn't wobble around. so, a very good purchase, but the extra bottle loss can be a big deal to some..."
5.0 out of 5 stars,"the bag was delivered very quickly. it seems to be of good quality with strong velcro straps, sturdy fabric, and a smooth working zipper. it is easy to mount to the bike and stays in place perfectly. there is some stiffness to the fabric and gravity does the rest to keep it where it belongs. i hardly know it is there but it is large enough to hold my phone, lip balm, wallet, keys, sunglasses and room for more.bike clothes are not known for an abundance of pockets so this bag lets me take the items i need in a compact and secure manner.edit: i have had this bag for a year now. it is still as good as new even after 3000 miles of sun and rain exposure. it does fade a little but a treatment of '303 protectant' brings is back to new (temporarily). i now have a second one for my second bike."
3.0 out of 5 stars,"i've had this bag for 13 months and i just replaced it with something else (it's seen ~2,000 miles of road time). still technically works, but it's starting to fail in the place i was initially worried about upon buying it... the top tube strap attachment points. i just don't think you can use this design with a bag with this much volume. either it gets filled with stuff that weighs it down, pulling at those attachment points, or you don't put that much in it, and it flops around, pulling at those attachment points. the bag i replaced it with has molle-type loops with separate velcro straps, which i feel does a better job of distributing the weight on the stitching."
1.0 out of 5 stars,"the color i received was nothing like the golden yellow that is pictured. instead, what i received is a pale faded out yellow with an odd neon green tinge. the packaging shows that sporty neon green color, the seller’s picture shows a rich golden yellow, and the product itself is neither color! i would’ve taken one color or the other but this is coloration is so appauling i can’t even stand it on my bike. now i get to experience the pleasure to return the item at my convenience because the seller is misrepresenting the product. the picture is a complete misrepresentation of what you will receive if you order the yellow."
3.0 out of 5 stars,"my biggest pet peeve is that it’s hard to center with the seat tube. it attaches to the frame fine and takes some trimming depending on your bike, but the attachment that secures to the seat tube is too far up on the bag, causing the bottom portion of the case to sway back and forth while riding, or just be lopsided. i only carry a tool, my lights and a small back up pump so it’s not a lot of weight. i would love to be able to fit my lock in there too but there isn’t quite enough room. i guess you get what you pay for, i just don’t like that sometimes it gets lopsided enough to where my foot and/or leg brush against it from time to time."
4.0 out of 5 stars,"this is exactly what i needed to keep clutter out of my pockets while riding. i can hold my phone, keys, wallet, and even sunglasses no problem. the only bummer is i have to detach this when putting my bike on my hitch rack when driving. other than that the three straps take little time to reattach. my rides are much more enjoyable without stuff in my pockets. i do not ride in the rain therefore cannot comment on weather resistance.**update** dec. 2020 - i have owned this for 9 months. the straps that attach to my bike frame are loose now. i took one star away because it could be sewn better. i am using safety clips now. eventually i will need to replace product as i feel it is not meant to last for years."
4.0 out of 5 stars,"i just bought a $3k e-bike (electric bike), & have enhanced it with remote-controlled turn signals, a gps unit, & even custom-designed foot pegs! along the way, i've put together an entire set of tools to adjust everything. i was looking for a bicycle pouch that wouldn't get in the way of riding, & this pouch is perfect! took < 1 minute to install. only problem is that the fuller it is, the harder it is to open & close. however, because everything else is just right for my needs, only loses 1*.highly recommended, especially if you don't want bulky saddle bags poking out from the frame of your bike / e-bike!"
4.0 out of 5 stars,"not a bad frame triangle bag. the velcro straps are long enough to go around thicker bike frame tubes and it sits fairly well on the bike with sloping top tube. not perfect, but not bad. the size of the bag is okay, and the volume inside is more than expected by looking at it... the way the velcro is mounted to the bag doesn't look like it will stand the test of time, but only time will tell. the material is okay for this price point. the bag is okay for this price point.better than nashbar's triangle bag... what a piece of junk that is... they use to sell good bags, but not anymore.we'll see how it holds up over time."
3.0 out of 5 stars,"bought this for an old schwinn road bike. the straps are long enough that when pulled tight they can not fasten. i have to double them around, and the hook and loop fastener is only making about a square centimeter of contact. i will probably cut the straps and sew them back on after removing some as it doesn't seem like this will be very secure on a bumpy road.the bag seems pretty low quality all around but sufficient for its intended purpose."
4.0 out of 5 stars,"this bag is pretty large. it has lots of room. it only seems to fit under the seat of my bike, the straps are not optional to place it on the front. the zipper is on the left side so you can only open it from the left because of how it has to be installed due to where the straps are. therefore, i have to get off my bike to get something out of it. it's a good bag however, the 2 things i don't care for are where it can be installed and the opening on the wrong side for me. otherwise there's plenty of room to put things in it. i'll get used to the downfalls."
4.0 out of 5 stars,"i bought two of these in hopes that i could use on my bike and grandsons. unfortunately, because of where the bars are place and where the zipper opens they did not fit. but that being said, i wish they would have fit because they seemed very well made and if they would have fit, i would have liked them. didn't put them in a rain storm but the zipper seems very snug and the velcro adheres well for a snug fit on the bike. loved the colors as well. i could get it on the one bike but the zipper pointed down so if i would have stored anything in it, when unzipped it would have all fallen out. might be great for a mens bike but unisex and women's the straps are not placed to where it will fit. i returned and got a refund very quickly which says a lot for the seller!!"
2.0 out of 5 stars,"i was happy when i received and started using in july 2020, it's now september and bike pack is starting to fall apart. noticed a small hole developing after less than two months! would i order one again, maybe, if it was better built. if the developer/creator wants to make a better bag, use better fabric and stitching. may i also recommend that once you unzip this is one big bag, meaning no inside pockets or elastic to hold keys or hold clip.i would not order this product again without being reworked and of course it's too late to return."
3.0 out of 5 stars,"for what it is, a flimsy pouch, it's very much overpriced. it does the job, so it will work just fine for my needs. the velcro straps seem to be made for thicker frames and are too large for smaller ones. i had to give it some slack to properly secure the velcro and then i had to cute the end of the strap short. the item has a strong distinct petroleum based chemical smell, which is probably not safe in the long run. i suspect that this has to do with their waterproof coating. as long as you don't touch it too much and keep it on your bike, it should be fine."
4.0 out of 5 stars,"i've ridden several hundred miles with the bag. my only problem is that it hangs down far enough that i can not get a water bottle into the holder on the seat tube. i have a large (60 cm) frame with a horizontal top tube. i'd guess everyone will have the same problem. however, it does hold tools, an inflator with spare cartridges, a couple of tubes, wallet, and phone. it has a nice inner pocket to help keep thing separated. it stays out of my way when riding, but is easier to access than a bag mounted behind the seat."
4.0 out of 5 stars,"i bought this bag for my wife's new specialized street-mountain bike to replace an old under-the-seat bag that interfered with a new rear light. initially i was worried that this new bag would not fit well in the frame at the seat post end because the angle was not 90 degrees. but, it did fit well, and is successful. the reason i don't give this 5 stars is that the velcro loops for attaching to the frame are really intended for round frame tubes. the new bike has a wide oval frame tube for the cross bar. it works, but this arrangement leads to some interference between the zipper and frame tube. realizing this, i can arrange the velcro to mostly keep the zipper away from the frame. i am still considering if i should add some friction tape on the frame, but i don't like the idea of the glue on the tape getting gummy in summer heat. the manufacturer should consider an updating the design to prevent contact between the frame and the zipper and accommodate non-round frame tubes. as a small aside, the purple trim on the pouch matches the deep purple frame color on the new bike."
5.0 out of 5 stars,"i purchased this bag to carry my on the road tools while i’m out on my bicycle, it works like a charm the straps keep it in place firmly i have not had to adjust once yet and i’ve had it for over a month on average i ride 13 miles per day.it’s currently carrying a mini bike pump, tire patches, and a bicycle repair tool, as well as my charging cord for my bicycle light. in addition to those things it was able to carry all of those items plus my phone, car keys and wallet with no issues.if you are planning on being a serious cyclist you will need to carry emergency equipment and tools and you would need a bag like this for your journey/adventures. i would highly recommend this bag, the material is nice and sturdy. i don’t ride in the rain but if i did i’m fully confident that the bag would not deteriorate.i hope you find this review helpful."
2.0 out of 5 stars,"if i had bought this for myself and used it to carry keys or my cell phone, then i'd give this a higher review as it does attach easily and does carry stuff that you'd rather not keep in your pocket. the trouble is that i bought this for my developmentally disabled brother. when my parents passed away and i became his guardian he was 272 lbs. i got him into a gym with a personal trainer, worked with a nutritionist to change his diet, and promised him a red trek electric bicycle (his dream) if he got to 199 lbs. he did it, but the bike is expensive, so i got him an expensive chainlock and this case to hold it. it fits in the case nicely, but after two weeks the straps started coming loose from the case. i fastened them back with stove bolts and they held nicely, but then the zipper broke and is just not repairable. i gave it two stars because i feel people who give one star lose credibility because they sound like mr. crankypants. i'm not cranky and i'm not saying don't buy this. just don't expect much from it."
