Stars,Reviews
1.0 out of 5 stars,"one velcro strap broke less than 5 minutes into my ride. the second velcro strap was holding on by threads a few minutes later. i had a spare tube, co2 cartridge and inflator, multi tool, wallet, and phone in the bag. i feel it should have no problem holding essentials without a complete failure."
5.0 out of 5 stars,"i can stick my phone, wallet, keys and so much more in my bike pouch. it comes in handy when i’m biking and don’t want to carry items in my pockets. easy to secure everything."
5.0 out of 5 stars,"the product works as advertised. i had an under seat bag prior to this that required me to pick and choose the gear i could bring on the ride. this product allows me to empty my pockets upon arrival and place it in the bag. in addition, i ride now with a multi-purpose bike wrench, air pump and patch kit should the unthinkable occur with room to spare."
5.0 out of 5 stars,"large carrying capacity. i can easily fit my wallet keys phone and some tools in this bag with space to spare. the internal mesh liner is great for separating scratch prone items, like my phone, from everything else. i use a large u lock, but if i used a cable style lock it would fit here quite easily. a real bargain for the price. i would have been happy paying $30 for it."
5.0 out of 5 stars,"this bag is great. it holds quite a bit and i hardly realize that it is there while riding! the straps do an awesome job holding it firmly in place. if you’re looking for a bag to fit on the frame, you can definitely purchase this one with confidence. (i did go over the lettering with a sharpie on mine 😎)"
1.0 out of 5 stars,"avoid this productit does not hold well on the bike frame. constantly swings back and forth interfering with peddling. the straps (all 3) do not hold tightly, and are way to long with nowhere to put the excess, so they scratch you while riding. basically, between the bag swinging, and the excess straps scratching you this bag makes it unbearable to ride the bike!"
3.0 out of 5 stars,"how it mounts and its size it just right for my use. i thought it a little odd that the zipper is on the left instead of the right, being most people are right handed, but no big drawback. i did not like the big brand-name logo put on it, and the biggest dislike to the pouch, and i put some black ink to the logo to at least dull it out, being it distracted from the looks of my bicycle, in my opinion. i don't like bill-boarded brand names on products."
5.0 out of 5 stars,i finally got an opportunity to use this product on a 10 mile bike ride yesterday it fits my keys my phone and a couple other assorted items and it kept it secure and it sat right above my water bottle. it is absolutely perfect for my needs and i would recommend it for anyone who has to carry essentials while riding
5.0 out of 5 stars,"i needed a place to put essentials (phone wallet keys and water) while riding, and it's very out of the way with this pack. it's able to hold a regular sized water bottle without much trouble, though i don't think that's what it was even meant for. great pack!"
5.0 out of 5 stars,"i love this bag. it is made of great quality, holds all my tools, and phone with room to spare. it fits perfectly on my bike. it was bigger than i anticipated but it fit my bike snugly and the zipper is to the side of the straps so it is easily accessible."
5.0 out of 5 stars,"got this so i could empty pockets on bike rides keep id , air pump and contact case still room for more no problem with any interference with legs while pedaling"
5.0 out of 5 stars,ordered this bag for my roadbikeonly ordered one but they sent and charged me for two but they were so nice i didnt even bother sending one backordered it in blue but also got a black one that looked way better on my roadbikeif ur looking for an affordable nice frame bag for ur bike to ad a lil storage you cant really go wrong with the aduro triangle strap on
5.0 out of 5 stars,"i was worried it would be too big, it is not. my lock fits in the bag, with my cell phone, and a wrench. it streamlines with the bars above, behind and below. thus my legs are never going to hit the bag when i peddle and fly down the bike path. one last thing, it looks like i picked the perfect color as well."
4.0 out of 5 stars,"after installing the first bag, i noticed a seperated seam on the bottom edge. amazon quickly replaced the bag, and the new one is in much better condition. it's held up well on several rides, but it does take some adjustment to fit the frame properly."
3.0 out of 5 stars,"i like everything neat and tiddy. my issue with the aduro bicycle storage bag is that it slips forward and downfrom the position in the picture. this could be fixed if the velcro straps were attached closer to the apex of this 90 degree triangle. the bag slips out of position because the back side of the velcro straps can't get a grip on the shiny surface of the top tube and seat tube. picky, plcky, plcky, lol"
5.0 out of 5 stars,"i ride my bike into work nearly everyday. this little pouch is great for holding my simple cord/lock, wallet, cell phone, and keys. if you are looking to tour de france or cross country and this will carry heavy gear, you picked the wrong underslung baggie. i especially like how easily i can access the pouch through the zipper while i am pedaling."
1.0 out of 5 stars,"this thing went on my bike great, but one of the strap buckles broke a week after i got it. i managed to replace the buckle with a small carabiner i had and secure it back to the bike...then a week later the zipper split open. total waste of money. if it wasn't such awful quality it would be great. but it's useless after you use it a couple of times and it starts falling apart."
4.0 out of 5 stars,"storage bag is very handy especially for long rides. it's easy to fit multiple items within the frame bag. the bag allows one to store enough essentials like small snacks, a phone, wallet and some spare bike tools. the only negative i can point out is that the bag isn't all that waterproof, so i would suggest placing water-sensitive items within a plastic bag inside the storage bag. stitching doesn't seem too bad; only time will tell how it holds up."
5.0 out of 5 stars,i wanted a small bag that was out-of-the-way that could carry my cell phone and my wallet. this is a good-looking bag that seems well-made and holds my iphone x max and my wallet easily.
5.0 out of 5 stars,"fits great on my road bike and my wife's cyclocross bike, doesn't fit on my triathlon bike, but that's because of the frame shape of the bike. has a little mesh pocket to hold phone, wallet, or whatever you wanna put in it. made carrying tools easier"
5.0 out of 5 stars,"they cycle storage bag is nice. however, it is intended for a male’s cycle. as such, it doesn’t fit exactly as intended. still, i confident in security of fit."
5.0 out of 5 stars,"i have bought this storage bag and have installed this weekend on my byke.it feeted perfectly on it, looks nice and now i have extra storage to grab a few things in my rides.the quality of the products did satisfied me. recommend to all."
4.0 out of 5 stars,nice product. looks good on my bike. i can fit my keys and a water bottle and a few other small objects. but you cannot zip it closed one handed. if you open it while riding you will probably have to stop to zip it close.
5.0 out of 5 stars,"i've been using this storage bag for several times on my bicycle outings. the capacity is good, and the zipper keeps everything securely stored. the 3-point strap keeps the bag on the frame well. the width does not imped leg movements, but the bag does contact the water bottle that i also placed on the frame. i am happy with the bag and would buy again if needs arise."
4.0 out of 5 stars,"this is a nice roomy bike bag. i can get my keys, phone, vape, wallet, bike repair tools in it and still have room! the only thing is, it might be to big for a water bottle on the lower part of your bike with this bag. if your trying to grab it out with the bag on, its pretty hard to do while riding. i usually have to pull over to take a drink because i cant pull it out or put it back in with the bag on. overall i like the bag, but i probably will use a different one if i plan on riding all day and drinking without stopping during my ride."
5.0 out of 5 stars,"great for spare tube and bike tools. check the size and where the water bottle holder hits. it works on my son’s 26.5” bike but it’s a snug fit. i have to remove it prior to placing bike on our bike rack. overall, gets the job done!"
1.0 out of 5 stars,not for heavy items. i filled the bag with a spare tube and tools. after a few weeks one of the velcro loops simply tore out. replaced it with the following:https://www.amazon.com/gp/product/b079hqsc8s/ref=oh_aui_detailpage_o04_s00?ie=utf8&psc=1rockbros 100% waterproof bike bag triangle large cycling tube pouch quick release frame bag 5lno problems so far - much sturdier construction.
5.0 out of 5 stars,it appears it will work well. less functional because of my bottle cages. not certain about weatherability in the rain yet. there are no locks. it is very accessible.
5.0 out of 5 stars,have really enjoyed having this storage bag on my bike. easy to install. holds my iphone and car keys easily. lots of room inside the case. quality is good.
4.0 out of 5 stars,had it for about 3 months and it was fine. now the zipper broke. i guess it’s cheap enough that no one should expect real quality.amending my review since i have now fixed the zipper on my own. no big deal. the bag is very useful for carrying small items. only down side is that i have to take it off to load the bike on my rack (a tow hook rack).
3.0 out of 5 stars,the bag looks and feels fine although it is smaller than i pictured. the straps for connecting are not long enough to fit my bike. it is built for the normal round tube framed bike and mine is not.
4.0 out of 5 stars,"the bag has good storage capacity, but the zipper sits uncomfortably close to the hook and loop straps, making it awkward to use. upon first use, the zipper skipped and had to be forced open. i don't foresee it lasting more than a few weeks with how much i plan on using it.in short:pros: good storage capacity and easy to installcons: poor build quality, and hook and loop straps had to be cut shorter to prevent about 2 inches of excess."
5.0 out of 5 stars,"this is a good storage bag. i use it to store my phone, tools and spare inner tube when i go on long rides. i made this purchase after i went on a 20 mile ride and ended up walking five miles after a nail punctured my rear tire."
5.0 out of 5 stars,"i attached this on my 2010 schwinn ranger and it's great. my smartphone (5.5"" galaxy note 5), wallet and first-aid kit fit in well with a lot of room to spare. awesome buy and i love it."
5.0 out of 5 stars,i needed this to hold my cell when out for a long ride. it fits nicely within the frame with very little fabric extending beyond the frame tube.
5.0 out of 5 stars,"i ordered 2 of these bags for my handcycle. they just arrived today and i transferred all my tools, spair innertubes, goo, etc and have lots of room left for snacks or whatever. they fit perfectly between the drafting bumper and the frame."
1.0 out of 5 stars,mine fell apart after only maybe 8 rides. straps broke and i had to carry it back for a good 5 miles while steering with the other hand. not ideal
5.0 out of 5 stars,"neatly tucked in the frame. easy installation and great to store wallets, phones, and keys when biking. fits small 8oz bottles too (tight)."
5.0 out of 5 stars,"fits my phone, multi tool and spare tube. the only thing is that the water resistance isn't the best... left it out in the rain one night and the things inside got pretty wet. probably can take light rain"
2.0 out of 5 stars,plastic buckles broke within a month. waste of money. i emailed customer service and they replied 2 weeks later asking a useless clarifying question and then haven't responded since then.
5.0 out of 5 stars,good product that arrived pretty quick. my bike has a bit larger frame size but this fit fine. quality of the materials is not an issue but i've only had it a week or so by now and just a few rides but would recommend.
5.0 out of 5 stars,"great place to stow my phone, wallet and emergency tool. don't even notice it's there when riding. highly recommend it to anyone trail riding"
4.0 out of 5 stars,"the bag is good. a little bigger than i expected. i have an extra small women's road bike and the bag does not allow enough room for my water bottle. no big deal for me, i'll have to find another place for a water bottle. i use the bag to carry a very heavy lock. so far, for the several days i've been using it, it's been holding up well. i think it will continue to do so."
5.0 out of 5 stars,"like this for spare inter tubes, gloves, pump, stem tightener etc. and it easily transfers to another bike. just getting into biking and have ""learned"" the value of spare parts after a couple of flats. now that i have the parts on board, no more flats....go figure ; - )"
5.0 out of 5 stars,"i've got an older raleigh m40 and it fits very nicely and holds my cell phone, identification, and personal protection i.e. pew pew."
5.0 out of 5 stars,perfect fit for my husband’s bike. looks nice and sleek and flush to the frame. more storage than i imagined.
5.0 out of 5 stars,"sometimes, you just need a place to put items besides your pocket. very handy. i was able to fit a run of the mill disposable plastic water bottle in it."
5.0 out of 5 stars,"this little storage bag did not disappoint. it attaches securely, has plenty of room for my phone and keys, a packet of tissues, with room to spare."
4.0 out of 5 stars,"this little pouch is well made. i am not able to use it because it just doesn't fit on the mountain bike the way i had hoped it would - which is no fault of the product - just make sure you have enough room for it and it will not be interfering with any cables, etc."
5.0 out of 5 stars,"i was skeptical if this would suit my needs or not, it has with each of my concerns! would it stay in place - yes. would my legs rub against it - no. would it be to big/small - no. would it hold my sidearm securely while riding, giving me immediate and easy access if needed - yes. i give this item an easy 5 stars!"
3.0 out of 5 stars,"i found the bag to be a bit wide, causing it to constantly brush up against my leg while riding. hard to attach, and placement in general is just awkward. offers a good amount of storage, but i think saddle bags that attach under the seat are better."
3.0 out of 5 stars,it's much smaller than the picture. and more difficult to store things in it due to it's design. good luck getting a phone in it. if you are lucky that about all you'll get in there. would not recommend.
5.0 out of 5 stars,"purchased for my son's birthday. he received it on time and reports to me that he really likes it. i liked the design, as i don't care for under saddle bags that much. i may get one of these for my bikes and remove my seat bags..."
5.0 out of 5 stars,i love this it fits on my bmx bike and it works well i do wish there where more pockets for stuff but still is a great item
5.0 out of 5 stars,this seller is outstanding!! both my bicycle items arrived in quick time and in perfect condition. the bike storage bag allows me to put all my pocket stuff in there and leaves me with less discomfort when riding. love this product.
5.0 out of 5 stars,"it is a little hard to say if the color comes out right, pictures vs product, but the size/shape/weight of the bag itself is ideal for most rides: keys, phone, gloves, etc. all for fine w/plenty of room to spare, and the internal net makes accessing small items while riding super-easy!"
5.0 out of 5 stars,"i use this storage bag on my raleigh venture 3.0. it is ideal for carrying my cellphone, id and basic bike tools. bag was very simple to attach to bike frame and does not interfere with pedaling."
5.0 out of 5 stars,"this is a very handy storage tool for your bicycle.not sure why ""security features"" is an option here, it's just a zipper, but it works very well."
5.0 out of 5 stars,"the medium bag fits my small bike frame (48"") perfectly. it's narrow enough that it doesn't get in the way, but holds a decent amount of gear. seems to be well constructed. the three velcro straps hold the bag securely. (still have room for one water bottle on the frame.)"
4.0 out of 5 stars,i’ve had this on my bike now for a couple months. it’s still holding on good and no signs of coming apart. the only issue i have is zipper placement. it’s very close to the bar so it makes it a little bit of a pain to open and close. not a big deal though. i’d buy it again.
1.0 out of 5 stars,this bag is made rather cheaply. i've been riding with mine for about 2 months and the straps have just about ripped off. luckily i saw it before my last ride so it didn't rip off during one of my ride's. unfortunately i just passed my return window.
5.0 out of 5 stars,"a little bigger than was expecting, but does not interfere while peddling. did not like my under-the-seat bag and always was just a little too small. have lots of space now."
4.0 out of 5 stars,"+ room for tools, spare inner tube, raincoat, etc.+ light weight+ fits well- zipper seam ripped after a few months of use- be careful to avoid brake cable on some bikes"
5.0 out of 5 stars,"great storage bag. secures very tight against the bicycle frame. i have a full travel size first aid kit, 2 patch kits, an air gauge and a bike multi-tool, and i still have room for more items. definitely recommend this to anyone looking for a very spacious and rugged bag....and the best part is that it's about half the cost of a typical ""bike store"" bag"
5.0 out of 5 stars,"easy to install obviously. i have plenty of room for my bike tool kit, misc wrenches, phone, wallet, a few little extras if needed. also can fit water bottle, its tight on my mg hitch but it fits."
5.0 out of 5 stars,great for storing bike tools so the pressure is off your back especially if you plan to have a back pack while riding.
1.0 out of 5 stars,"the stitching on the attachment points is extremely low quality, came unstitched after one ride. would be completely unusable if i didn't sew it back together myself with higher quality thread. the velcro straps used to attach to the bike are also way too long- i have a pretty standard road bike frame but when tightened there is barely enough velcro to hold it on."
5.0 out of 5 stars,this is a great bag for our 12-year-old son. he rides his bike to school and he puts his bike lock in there when he rides to and from along with storing his gloves. can hold mini water bottles as well
5.0 out of 5 stars,very functional for a few small items. looks good too. be aware that you won't be able to install a water bottle cage on the down tube. also need to remove bag for the type of bike rack that i have for my car.
4.0 out of 5 stars,"exactly what i needed for my rides. streamlined, not bulky, holds my wallet, phone, keys with room to spare so i don't have to wear a fanny pack when i ride. haven't gotten it wet yet and while it doesn't lock it securely holds your items. my only criticism is that the velcro straps were too long. had to shorten them up to get a tight fit on my frame. otherwise a great little storage bag."
5.0 out of 5 stars,"i bought this bag to attach to the handle of my walker so i can carry my iphone, keys, etc. it fits perfectly and works just as i had hoped!"
1.0 out of 5 stars,product lasted just over 30 days before one of the seam's ripped almost lost my belongings..not recommended!!
5.0 out of 5 stars,"got this bag for my son to use when he goes biking. it's perfect for holding his wallet and cellphone. is also large enough to fit a few more things, if needed."
5.0 out of 5 stars,i love how this product look and functions. i used as soon as i took it out of the package and it holds my cell phone and keys with room to spare. thanks for such a great product.
1.0 out of 5 stars,"warning: when trying to attach this a bike where the brake line runs under the main frame, tightening the bag properly results in sticky brakes. also, it is rigid enough that forget carrying anything else in that area... no water bottle, and your lock has to be contorted to get around it. not practical or functional."
5.0 out of 5 stars,just the right size to store everything i need. the one velcro strap that attaches to the verticle part of the frame is long enough to allow my bike rack to pass between the bag and frame. very happy with my purchase
1.0 out of 5 stars,not a durable bag as i'd thought it was. cheaply made. put any tool in tupperware then put that in the thing.
4.0 out of 5 stars,"pretty much exactly what you would expect. seems plenty sturdy enough and holds enough to make it possible to not wear a backpack for long rides. i can get a mini pump, extra tube, a few tools, wallet, phone and car key into mine without any issue. if you try to go more than that the sides will bulge out so that they brush your legs, but i am glad to have it."
5.0 out of 5 stars,nice bike bag i switch from trek hybrid to a felt road bike and a bag fits perfectly on either bikeenough room for a phone (if you don’t mount your phone on the handlebars) house keys and a few other small items like a protein bar or protein gel
4.0 out of 5 stars,"i intended on this being a little more centered in terms of mounting on the bike to fold out to accompany more storage space. i now see the intended purpose. it’s good at holding my bike gloves and a small bike rope lock, it won’t expand and close with much more. very easy install. overall good protection from weather. 3/5"
1.0 out of 5 stars,"the item zipper is placed on the bottom. which is awkward and uncomfortable to put you cell, water ect."
5.0 out of 5 stars,".we bought two for our mini-pro segways and the fit just right. carries our chargers in the bag and assorted other needs. durable, zippered, and three straps that are velcro. price vs performance: good"
5.0 out of 5 stars,can easily fit a spare tire or tube in the pouch plus multiple other tools. happy with this purchase!
5.0 out of 5 stars,wanted a bike storage that was a roomy enough for me to carry all the essentials. this has plenty of space and a durable feel. it does take up the space for my second water bottle so i might use a different bag for rides where i'll need to carry the extra water. but very happy and would recommend!
5.0 out of 5 stars,"delivery was prompt and product exactly as pictured. plenty of room for phone, wallet, keys,tools. my favorite kind of accessory: installed it doesn't cost you a second thought. durable materials."
5.0 out of 5 stars,"nice product to store my spare tube, changing tools, and my bike lock. also thin enough to not hot my legs as i pedal nor be in the way of my water bottle mount."
5.0 out of 5 stars,"easy to put on, carries what i need and keeps it all safe and dry. it’s a great case that doesn’t get in the way."
5.0 out of 5 stars,"i just love this thing; the straps hold everything steady but easy to remove, is does not bother me while pedalling, i currently have inside a minipump, wench, tire patchs, hex keys, spare tire, and i think i can fit some more stuff. the thing? the price."
5.0 out of 5 stars,"this is an excellent accessory back that nicely/cleanly fits under the cross bar of a man's bicycle. i do not know how it will work on a bicycle with a drop bar. the bag is large enough to hold a cell phone, keys, snack(s) and a few tools."
5.0 out of 5 stars,good bag on the touchdown geometry up tube bikes. can't find a place on the radrover but fits on the tuesday model quite nicely . using it for water and cash. works perfectly.
2.0 out of 5 stars,make sure the dimensions work for your bike. it really only fits if you have a perfectly square corner of rails. costs 5.99 to return so not worth doing that... guess i will just keep it or give it away. it’s useless for most bikes
5.0 out of 5 stars,i needed a bag larger than my undersea bag to bring along tools. this is perfect and looks great. very happy with my purchase.
5.0 out of 5 stars,"nice compact storage accessory. fits well and still allows space for my water bottle holder. very satisfied, this works well for my purposes, keeps cell phone and wallet for easy access. blue matches my bike frame perfectly!"
4.0 out of 5 stars,"this is a very nice compact storage bag that has been dk 200 tested.just a couple thing that i would like to see added to the bag. the velcro ties could be double stitched for durability (i had mine double stitched by our local upholstery). additionally, it would be nice to have a limiter on how far the zipper can unzip. while riding on gravel and you want to access your nutrition on the go, you could potentially open the ban to wide and have items fall out.you need to be aware that you lose one bottle rack as the bad occupies that space."
5.0 out of 5 stars,this product is great for what i need while riding for my phone or wallet.most important the shipper reached out to me and replaced this product free of charge when i received my 1st order damaged and followed up on the 2nd order. great customer service
5.0 out of 5 stars,"very good size for samsung note phone, wallet & keys. seems well made. fits snug. recommend & plan to buy another for 2nd bike."
5.0 out of 5 stars,great little pouch. i’d like to see a version with an expandable compartment but for now this serves my purpose
4.0 out of 5 stars,bought this to hold my phone while out on the trails. also can run my headphones without having it in my pocket.
