Stars,Reviews
5.0 out of 5 stars,"ok it holds my iphone plus, positioning on bike is very secure. zipper is high quality, easy to use."
1.0 out of 5 stars,"very cheap, zipper was non functional from the start and jumped off track when i tried to force it. trashed it, i’ll just go buy one from walmart."
5.0 out of 5 stars,good for water and other items
4.0 out of 5 stars,its just a little bigger then i anticipated. good construction though.
5.0 out of 5 stars,awesome! well designed and perfect size for small pistol...
5.0 out of 5 stars,"so far, so good. it works perfectly for the items i carry on every ride. it’s quite roomy."
5.0 out of 5 stars,"excellent products, arrived as described incredibly fast shipping! thank you!"
5.0 out of 5 stars,"perfect carrying bike lock ,cell phone and keys."
1.0 out of 5 stars,the straps were mistakenly sewed to the body of the bag. when i tried to exchange it they raised the price for $5 which is equivalent to 40% price increase in matter of days.
5.0 out of 5 stars,this bag looks good and has a lot of space!
5.0 out of 5 stars,"super love this on my bike! it holds everything, i need without being too heavy."
1.0 out of 5 stars,one of the straps ripped off after one month! i've only need carrying my lights and bike lock in it so i don't think it's overloaded; just very cheaply made. wouldn't recommend
5.0 out of 5 stars,durable and discreet bike bag with quite a bit of storage room.
5.0 out of 5 stars,"it's perfect, good material, lot's of space, good price!"
5.0 out of 5 stars,"fast shipping. lots of room for phone, keys, and wallet."
5.0 out of 5 stars,a+++
5.0 out of 5 stars,a+
5.0 out of 5 stars,extra storage
5.0 out of 5 stars,"perfect size to fit my over-sized phone (android), but still slim and not bulky."
5.0 out of 5 stars,great addition to my bike! perfectly stores my accessories!! i love this and i would buy this again
5.0 out of 5 stars,"perfect size, easy to install, looks like it was designed for my bike"
5.0 out of 5 stars,nice bag
5.0 out of 5 stars,"so great i bought a second one for my wife. excellent storage, great connectivity to the bicycle, and it is not in the way."
5.0 out of 5 stars,amazing how much can fit in this bike bag.
5.0 out of 5 stars,"the bag is solid, attaches quite easily to the bike frame and is very functional.i would like to be able to lock the bag both to the frame as well as to protect the contents."
1.0 out of 5 stars,"the bag is great, however the straps that connect it to the bike not so much. the strap that wraps around the seattube broke off less then 2 weeks after purchase."
5.0 out of 5 stars,it’s exactly what i wanted and fit perfectly for a mans bike
5.0 out of 5 stars,perfect fit for my trek fx3. it doesn't interfere with my legs pedalling and is sturdy. zipper is smooth and overall has a clean look.
5.0 out of 5 stars,just the right size. it holds everything that i wanted to put in it. looks like good quality with a good zipper.
1.0 out of 5 stars,waste of money. zipper is junk.
5.0 out of 5 stars,great!
3.0 out of 5 stars,"the seams on this product are not very strong. they've unraveled after less than a hundred uses. i like the design, but the product won't last."
5.0 out of 5 stars,i can’t tell about water resistance so i went middle of the way on that
3.0 out of 5 stars,this was a gift. don't know anything yet.
5.0 out of 5 stars,"i bought this bag so i could discreetly carry my walther pps firearm. i have my carry permit, and my walther fits nicely in the bag very nice!"
2.0 out of 5 stars,zipper broke after two months
5.0 out of 5 stars,bag is roomy & attaches to the frame firmly. no interference with legs while peddling. made of seemingly tough materials so should hold up well.
2.0 out of 5 stars,it worked perfectly the first 2 weeks but today it broke out of nowhere while i was riding
5.0 out of 5 stars,great!
5.0 out of 5 stars,awesome pouch! durable and fits just as described!
5.0 out of 5 stars,exactly as described...
4.0 out of 5 stars,👍🏾🙏🏽
5.0 out of 5 stars,perfect
5.0 out of 5 stars,it attaches easily. is roomy but is not in my way.
5.0 out of 5 stars,"great bike storage bag, perfect gift for the avid biker."
5.0 out of 5 stars,it fits all of our bike tools and air pump for our rides. its great!
5.0 out of 5 stars,seems like a quality product. works well for storing my compact tire pump and tire repair kit.
4.0 out of 5 stars,haven’t tested water resistance and didn’t know there are security features. but it’s the exact size and capacity i was expecting. on my frame (56 with pretty horizontal top tube) it fits even with a full size bottle on the down tube.
5.0 out of 5 stars,"the bag is wonderful. i use to ride having my phone in my pocket but this thankfully changes that. it's great quality and has plenty of space for my phone, wallet and even keys."
1.0 out of 5 stars,too big if you have a water bottle holder.
5.0 out of 5 stars,fits my bike great...stores all my necessities.
5.0 out of 5 stars,i love this product!it’s very light and fit nicely on my bike.it has a decent storage space and the shape is nicely designed.
5.0 out of 5 stars,great buy! i love this more than buying phone case mount with storage. doesn’t shift during rides and seems pretty durable so far.
5.0 out of 5 stars,"the aduro triangle storage bag meets my needs perfectly…it fits securely on the bike frame, offers easy access to contents, large enough to store all my loose stuff like keys, phone and wallet but not so large that it gets in the way, and the price was right."
5.0 out of 5 stars,"it doesn't fit perfectly if you don't have a bike with the top tube that looks like the one in the picture, but don't worry. i have a step thru bike so i needed to finagle the bag to attach using only two of the straps. nonetheless, the straps hold very well and i haven't had any issues. the bag holds a lot and is so convenient."
5.0 out of 5 stars,"as described, quick ship, good price, works great."
5.0 out of 5 stars,"the bike bag is exactly as described. easy to install, super spacious without getting in the way when you ride. shipping was really fast too. overall a fantastic product, i'm a fan!"
4.0 out of 5 stars,i bought this for my 28” schwinn trailway hybrid bicycle and i was bummed that it didn’t work. the bag was just too big.
5.0 out of 5 stars,the aduro sport bicycle bike storage bag triangle saddle frame pouch fit perfectly on my bike. nice and secure. and more than enough room in that little bag for my wallet and cell phone. great product. easy to install. i'm glad that i made the purchase. -steve in green valley az
1.0 out of 5 stars,the bottom of the bag ripped out after 3 months. very low quality.
5.0 out of 5 stars,great purchase
5.0 out of 5 stars,this is exactly what i needed so my cell phone is protected and out of sight but still able to be reached while riding. no need to stop and get into my back pack while bicycle commuting to work.
5.0 out of 5 stars,"the location is very handy. fits very well to my mountain bike, and has plenty of storage space. i’m storing my phone and wallet, but there’s more space left."
5.0 out of 5 stars,fit my wife's bike just fine
5.0 out of 5 stars,great little bag.
4.0 out of 5 stars,good quality so far. pretty big and fits as pictured
4.0 out of 5 stars,"great for carrying you phone, keys, garage door opener,"
5.0 out of 5 stars,fits like a glove.
2.0 out of 5 stars,i liked this bag until the zipper tab broke off. now i have to use my fingers to slide the zipper- and it doesn't work great. disappointed it broke so soon.
5.0 out of 5 stars,the simplicity of installing it.
5.0 out of 5 stars,exactly as described very pleased
5.0 out of 5 stars,switching from under seat bags that have failed. so far this is holding up.
5.0 out of 5 stars,for my boyfriend birthday present on his new bike he loved it
5.0 out of 5 stars,very good bag it's very handy.
1.0 out of 5 stars,"looked good on the bike, good amount of room. velcro strap tore first time on the trails. not durable at all."
5.0 out of 5 stars,"good products, quality. as advertized. would keep track of this offerings in the future."
5.0 out of 5 stars,perfect fit quick delivery
4.0 out of 5 stars,does what it's supposed to do.
5.0 out of 5 stars,"this is just what i have been looking for. it holds my cell phone, keys and lots more. well constructed and its easy to put on or take off."
2.0 out of 5 stars,"the bag looks great but once you throw a few things in there (co2, tube, snack, tire kit) it becomes too bulky and rubs against your legs making it a very uncomfortable ride"
5.0 out of 5 stars,love this bag. it is large enough to hold whatever i need for my rides yet small enough to fit my mountain bike just right.
1.0 out of 5 stars,would be good but two of the three plastic rings for the straps snapped/ broke after light use.
1.0 out of 5 stars,junk. shoddy stitching. wouldn't trust it to hold.tried to cancel order but amazon refused.
5.0 out of 5 stars,very hppy with the product. excelent size and quality. perfect fit.
5.0 out of 5 stars,it was a little smaller than i wanted.
5.0 out of 5 stars,works just as expected. easy install.
5.0 out of 5 stars,this bag is awsome! the placement of the zipper makes it easy to access during my ride. which is great! there is plenty of space inside the bag too for any tools etc.
4.0 out of 5 stars,great it’s light material make
5.0 out of 5 stars,big enough for sunglasses fon cash and sun screen
3.0 out of 5 stars,it's a nice little bag but it doesn't fit the bike
4.0 out of 5 stars,"nice bag, easy to instal and remove, very spacious and handy."
3.0 out of 5 stars,this product is about what i expected for the price. it’s typical import quality and is most likely a replace after 2 years. serves its purpose
4.0 out of 5 stars,nice bag...straps should be a little longer to accommodate a cruiser type bike.
5.0 out of 5 stars,it has plenty of storage capacity for things you want to carry on your bike trip. it dose not get in the way of peddling. which was a concern. buy it!
5.0 out of 5 stars,"i love this, use it everyday."
5.0 out of 5 stars,me gusta
5.0 out of 5 stars,works good. not bulky and plenty of room.
5.0 out of 5 stars,"item was just as described, fits my bike and need."
5.0 out of 5 stars,its good but anyine can get inti yiur bag when you keave your bike outside.
5.0 out of 5 stars,fits perfectly on my bike!
5.0 out of 5 stars,"good size, use it for holding phone while riding. the bag is well-secured to frame and out of the way."
5.0 out of 5 stars,plenty of room...
5.0 out of 5 stars,great product fits perfectly
5.0 out of 5 stars,works great !
5.0 out of 5 stars,love it
5.0 out of 5 stars,nice product. good quality. plenty of storage. great product for the price
2.0 out of 5 stars,"really poor quality, even for the price."
5.0 out of 5 stars,the color matches my bike and is just the right sze.
5.0 out of 5 stars,it will be very handy for things i won't need to carry in my pockets while biking.
5.0 out of 5 stars,this under the top tube bag holds as much as a large top peak under the saddle bag. nice!
1.0 out of 5 stars,velcro straps tore away in less than 3 months
5.0 out of 5 stars,good fit and quality so far.
5.0 out of 5 stars,excellent bag for ebike connection
5.0 out of 5 stars,great got holding cell phone while riding.
5.0 out of 5 stars,"shipment was lightning fast. cycle bag perfect for emergency maint kit (tools, inner tube, etc). waterproof too!"
5.0 out of 5 stars,"i bought the small/medium size and it fits perfectly on my trek fx 2. it rides just above my water holder so that is not an issue. it's reasonably rigid and holds everything i need for short rides (bike tool, speed/distance gauge, wallet, cell phone, keys, glasses, with room to spare. i really like the mesh pouch to keep my cell phone and glasses separate."
5.0 out of 5 stars,perfect fit!! fast and my son rode 100mi.
5.0 out of 5 stars,good price and protects my phone on those long rides!
1.0 out of 5 stars,"it says it fits any bike, but doesn’t. velcro is too long so when wrapping it around only the soft sides touch and does not attach snugly"
5.0 out of 5 stars,this bag fits perfectly on my bike and doesn't interfere with pedaling. my husband will be purchasing one for his bike also.
5.0 out of 5 stars,great bag for the bike.
5.0 out of 5 stars,it feels very well made and durable.
5.0 out of 5 stars,"great buy easy to install and fits my wallet, iphone plus and keys with space left over."
5.0 out of 5 stars,excellent roomy good quality
5.0 out of 5 stars,"fit well on my mountain bike, not so much on my wife's 'female' ride, made it work though - no complaints, keeps keys, wallets, cell etc ..."
1.0 out of 5 stars,"if you have a water bottle holder, this bag won't fit. buy a shorter triangle bag."
5.0 out of 5 stars,great product. what an improvement over the fanny pack...the ultimate sign of dorkdome.
5.0 out of 5 stars,good build quality and item as advertised
5.0 out of 5 stars,excelent
5.0 out of 5 stars,great bag...fits well!!!!
5.0 out of 5 stars,good product. easy to put on and off. fits all frame sizes. may have to remove when loading bicycle on bike rack.
4.0 out of 5 stars,seems to be constructed ok. we will see how long it last.
4.0 out of 5 stars,"pretty good. holds a surprising amount of stuff. i decided to re-sew the straps to make them more robust, but it wasn't necessary. don't expect this to last for the rest of your life, however."
5.0 out of 5 stars,"strong material, fast shipping. great experience"
5.0 out of 5 stars,perfect!
5.0 out of 5 stars,excellent product. it arrived on time & works as advertised. fits securely on my fuji road bike. i highly recommend this product.
5.0 out of 5 stars,awesome
5.0 out of 5 stars,i originally bought this storage bag for my trek domane. i loved it so much i purchased another for my giant fathom mountain bike. great bag with lots of space yet not too bulky. i defiantly recommend
4.0 out of 5 stars,i want to ride my bicycle and now i can keep a few tools and utilities with me.
5.0 out of 5 stars,worked as advertised
5.0 out of 5 stars,nice fit and holds all the stuff i need
5.0 out of 5 stars,i have an extra tube and the tools necessary to fix a flat
5.0 out of 5 stars,"good value, as they say it is!!"
5.0 out of 5 stars,i bought this for my son's bike which he uses to get to school and work.it holds everything safely for him and he can take it off and take it with him .
5.0 out of 5 stars,very nice product. arrived on time. easy install. hold phone and few tools. good size. good quality.
5.0 out of 5 stars,nice little storage bag
5.0 out of 5 stars,this has been great for our bikes. easy to attach and seems sturdy! the bag also fits with the water bottle carrier.
5.0 out of 5 stars,"perfect for lock, cell, and more! haven't filled it all the way."
5.0 out of 5 stars,"great little pouch! and it holds more than you think it would. i can put my phone, riding gloves, sunscreen, glass case, money, cliff bars, keys, and more inside."
1.0 out of 5 stars,at first glance this bag look good but i took it on one 20 mile ride and the straps fell off. it's pretty useless.
5.0 out of 5 stars,exactly as advertised and expected. fits well on my bike and functions perfectly.
3.0 out of 5 stars,"i like the bag however its over priced and where it’s located on my bike, it interferes with the bike placement when placing it on my bicycle rack."
2.0 out of 5 stars,"this bag broke the 4th time i used it--the straps are affixed very poorly to the bag. tried to save money, but next time will purchase from rei."
5.0 out of 5 stars,"it fits my bike lock and my little speaker , keeps things dry awesome deal"
5.0 out of 5 stars,i bought the bike bag as a surprise for my husband and he loves it. the bag holds his phone and keys and chain for his travels. i am so glad i ordered it.
5.0 out of 5 stars,easy to install. nice little storage
4.0 out of 5 stars,👌
2.0 out of 5 stars,material looks cheap and it came ripped.
5.0 out of 5 stars,perfect for my biking needs!
5.0 out of 5 stars,love the product!
5.0 out of 5 stars,fits my new bike perfect and has enough space that i no longer have to pack a backpack for my bike tools!!!
4.0 out of 5 stars,"it holds anything that’s fits it, except the velcro strap it’s a ok quality, but can’t complain, still a good buy!.."
4.0 out of 5 stars,good storage and light weight for bike
5.0 out of 5 stars,"just what my husband for his bike rides - cell phone, water, etc"
5.0 out of 5 stars,"a well made case fits the bike perfect, many uses"
5.0 out of 5 stars,"inexpensive, but works great."
5.0 out of 5 stars,nice size and good quality!
5.0 out of 5 stars,this bicycle pouch does the job!
5.0 out of 5 stars,great product
5.0 out of 5 stars,"i'm very happy with this bike bag, thank you very much!!!!"
5.0 out of 5 stars,"the product was exactly as promoted and fits well on the road bike. plenty of storage room for spare tubes and other items like wallets, cell phone, etc. great product."
4.0 out of 5 stars,great look. strong. big enough. velcro is a little short to wrap around my cross bar so i just added another few inches. couple bucks at the dollar store
4.0 out of 5 stars,nice bag. glad it is velcro
5.0 out of 5 stars,fits the bike. looks good.
1.0 out of 5 stars,the mounting strap broke immediately. never got a chance to use it.
4.0 out of 5 stars,"fits well, looks great on my bike,, would buy again, brought this to match my 29"" bike"
5.0 out of 5 stars,"using this saddle on my bike to carry my keys,wallet & cell phone. excellent product !"
5.0 out of 5 stars,a+
1.0 out of 5 stars,item straps ripped off while riding on only the second use. only had two smartphones and a car key inside at the time.
5.0 out of 5 stars,good product.
5.0 out of 5 stars,very large storage and very easy to attach
1.0 out of 5 stars,was ti big for my bike and my leg was hitting it on a long ride and gave me a rash :( too late to return
5.0 out of 5 stars,"fits perfectly on my bike and holds my iphone 8 plus and other items as well; and keeps them weather protected. i, also, like that it's padded for the extra protection. exactly what i was looking for!"
5.0 out of 5 stars,"thought that it would be bigger from looking at the photos. . . but it fits my bike good, and is very good quality!!"
5.0 out of 5 stars,like the shape and space of storage. also came on time
5.0 out of 5 stars,bag works exactly as expected
5.0 out of 5 stars,good
5.0 out of 5 stars,love it
4.0 out of 5 stars,nice bag lots of room. ended up installing it on rear end of top bar since it did not fit front..water bottle got in the way.
5.0 out of 5 stars,brilliant product just what i needed.
5.0 out of 5 stars,it's perfect.
4.0 out of 5 stars,allgood. holds a tube air pump leatherman bike multitool ondpressure gauge
5.0 out of 5 stars,product is very good. features as presented in description
3.0 out of 5 stars,"the bag is nice and slim, not bulky. i only carry my essentials. not water resistant like they claim...i got stuck in a downpour and everything in my bag was soaked. luckily i was able to save my phone!"
1.0 out of 5 stars,terrible!!! it ripped the first time i used it.
5.0 out of 5 stars,great product and great customer service 👍!
4.0 out of 5 stars,"great size for fitting in a decent amount of snacks and supplies, the only downfall it is hard to get to the water bottle with it on because of the size."
5.0 out of 5 stars,exactly what i wanted and expected.
5.0 out of 5 stars,workes well
5.0 out of 5 stars,works perfectly on my mountain bike
4.0 out of 5 stars,does the job
5.0 out of 5 stars,"i installed it behind my seat by adding a support under my seat. plenty of room for storage of my cell phone, eye glasses, and a protein bar."
4.0 out of 5 stars,easily attached or removed. decent amount of space in small package. does not rub or impede leg motions
5.0 out of 5 stars,stays firmly affixed to my bike and doesn’t get in the way when pedaling. fits a lot of stuff. highly recommend.
4.0 out of 5 stars,definitely holds everything you will need on your journey. larger than i expected and blocks use of second water bottle.
5.0 out of 5 stars,exactly what i was looking for. needed to hold cellphone and keys. plenty of room. looks great!
5.0 out of 5 stars,very nice bag!! lots of room!
4.0 out of 5 stars,bigger than i expected
4.0 out of 5 stars,this product looks great. i got it for my son and he loves it!
4.0 out of 5 stars,bought this for a nine year old boy to put his phone or walkie in while riding his bike. he liked it
1.0 out of 5 stars,i got this last august installed it on my bike last september 23 and now it got holes on it
2.0 out of 5 stars,would be a really nice bag however it or its contents can easily be stolen. its a little too big for the intended space on my bicycle and slightly bulky.
5.0 out of 5 stars,just right
5.0 out of 5 stars,the bike bag was exactly what i wanted. fits perfect and will be ordering a second one. really good quality.
5.0 out of 5 stars,"looks to be well made, strong zipper, and good quality fabric."
5.0 out of 5 stars,"great bag!! great price!!! perfect for my cell phone, pocket change and i.d.it does not get in the way and is easy to reach. love it!"
5.0 out of 5 stars,delivered as promised.
5.0 out of 5 stars,exactly what i expected. fits everything i need it to and more.
5.0 out of 5 stars,practicel
5.0 out of 5 stars,lots of room.
5.0 out of 5 stars,"feels durable, and good quality. big enough to fit a ligh jacked in it. very happy with this purchased."
5.0 out of 5 stars,"the storage bag is big enough for what i need, and stays secured in its spot as i'm riding."
5.0 out of 5 stars,awesome fit. storage is good. gray is much lighter then the picture.
4.0 out of 5 stars,good size but not in the way. for long rides room for lunch and extra water or a good tool set if in the wild.
5.0 out of 5 stars,works perfectly. very nice.
3.0 out of 5 stars,"be careful, this might be larger than you want. ensure it does not interfere with your water bottle or bike rack. beside that the item was in good shape and met everything they advertised. i just did not pay attention to the size."
5.0 out of 5 stars,"i like this product, just what i was looking for, no dislikes at all"
4.0 out of 5 stars,"easy to install. lots of storage. i can fit my wallet, keys, and lot more inside."
4.0 out of 5 stars,"nice product. only issue was the attach straps were too long for the 1.25 inch diameter tubes on my bike, but was able to make it work."
5.0 out of 5 stars,"my phone grew so my bag needed to grow. this is a great, out of the way storage bag. fits my iphone8+, power bar, bike tool, tissues, chapstick...."
5.0 out of 5 stars,so far it's as described and well made.will update if needed.
4.0 out of 5 stars,"very good bag, attached to bike perfectly."
4.0 out of 5 stars,awesome bag for my tools and my wallet thanks for fast shipping
5.0 out of 5 stars,good product 👌
5.0 out of 5 stars,easy to use
5.0 out of 5 stars,fits great and holds everything that i would normally have in my pockets.
5.0 out of 5 stars,like the bag holds my stuff
5.0 out of 5 stars,safe and sturdy. easy install and very good quality.
4.0 out of 5 stars,i wish was a little bigger
5.0 out of 5 stars,"i was looking for something that i could throw my keys, some sunscreen, and my iphone 8+ in, and this fit the bill perfectly. it's a little bulky, but i mean.. duh. it's great."
5.0 out of 5 stars,"does what it says, holds really steady. great for tools or misallenious items."
5.0 out of 5 stars,great product
5.0 out of 5 stars,"perfect for the use i have. i store keys, papers, a small fabric bag, my phone and there is still some space for gloves or something else."
5.0 out of 5 stars,era lo q buscaba
4.0 out of 5 stars,"it's a bag. it stays on my bike. the straps are slightly too short to fit very securely on the frame, but otherwise works as expected."
5.0 out of 5 stars,"easy install, great price. as advertised"
5.0 out of 5 stars,bought this to hold my tire repair kit. works perfectly and hardly moves around.
5.0 out of 5 stars,"it's exactly what i expected. it's not too big or too small. the velcro steps attach well, and the bag is secure to the bike frame."
5.0 out of 5 stars,half year usage. survive from extreme snowy or frozen days. the zipper still works perfect. i use it everyday and never broken down.
5.0 out of 5 stars,everything as portrayed.
4.0 out of 5 stars,"unintrusive and perfect for the small stuff you may need; backup battery for your phone, sunglasses, small wrenches.only wish it were a little bigger so my ipad pro would fit in for the short trips to the coffee shop..."
5.0 out of 5 stars,idéntico a la foto! compacto para que no moleste e ideal para guardar más de un teléfono y las llaves de casa
5.0 out of 5 stars,"just what i needed. carries my phone, keys and wallet with room to spare."
4.0 out of 5 stars,good decent bag that is being used for storage on bike rides.
5.0 out of 5 stars,"for my walker, will use as purse."
2.0 out of 5 stars,the pack itself is nice for the price but the stitching that holds the bag to the bike frame is poor quality. went off a 4ft drop and the stitching ripped off.
4.0 out of 5 stars,i liked that it freed up space from on top of frame and under seat. able to store everything i need aside from clothes for a long ride.
5.0 out of 5 stars,"i really like the double space inside this bag, you can put the inner tube in the big side, and some small stuff in the other side. very convenient."
5.0 out of 5 stars,easy to install for storage i normally keep my snacks sandwiches keys extra battery in it while i am out for my ride
5.0 out of 5 stars,fits and works great
4.0 out of 5 stars,good storage suggest you get
5.0 out of 5 stars,"great, well made product. ideal for storing compact repair kit, phone, wallet etc."
